<constraint-mappings
        xmlns="http://xmlns.jcp.org/xml/ns/validation/mapping"
        xmlns:xsi="http://www.w3.org/2001/XMLSchema-instance"
        xsi:schemaLocation="http://xmlns.jcp.org/xml/ns/validation/mapping
            http://xmlns.jcp.org/xml/ns/validation/mapping/validation-mapping-2.0.xsd"
        version="2.0">

    <default-package>org.hibernate.validator.internal.xml.containerelementtype</default-package>

    <bean class="org.hibernate.validator.test.internal.xml.containerelementtype.ContainerElementTypeConstraintsForParameterXmlMappingTest$IFishTank" ignore-annotations="false">
        <method name="test9">
            <parameter type="[Ljava.lang.Object;">
                <container-element-type type-argument-index="0">
                    <constraint annotation="javax.validation.constraints.Size">
                        <element name="max">
                            <value>5</value>
                        </element>
                    </constraint>
                </container-element-type>
            </parameter>
        </method>
    </bean>
</constraint-mappings>
