<constraint-mappings
        xmlns="http://xmlns.jcp.org/xml/ns/validation/mapping"
        xmlns:xsi="http://www.w3.org/2001/XMLSchema-instance"
        xsi:schemaLocation="http://xmlns.jcp.org/xml/ns/validation/mapping
            http://xmlns.jcp.org/xml/ns/validation/mapping/validation-mapping-2.0.xsd"
        version="2.0">

    <default-package>org.hibernate.validator.internal.xml.containerelementtype</default-package>

    <bean class="org.hibernate.validator.test.internal.xml.containerelementtype.ContainerElementTypeConstraintsForFieldXmlMappingTest$FishTank" ignore-annotations="false">
        <field name="tagsOfFishOfTheMonth">
            <container-element-type type-argument-index="0">
                <container-element-type type-argument-index="1">
                    <container-element-type type-argument-index="0">
                        <constraint annotation="javax.validation.constraints.NotNull" />
                    </container-element-type>
                </container-element-type>
            </container-element-type>
            <container-element-type type-argument-index="0">
                <container-element-type type-argument-index="1">
                    <container-element-type type-argument-index="0">
                    </container-element-type>
                </container-element-type>
            </container-element-type>
        </field>
    </bean>
</constraint-mappings>
