<?xml version="1.0" encoding="UTF-8"?>
<!--
  ~ Hibernate Validator, declare and validate application constraints
  ~
  ~ License: Apache License, Version 2.0
  ~ See the license.txt file in the root directory or <http://www.apache.org/licenses/LICENSE-2.0>.
  -->
<constraint-mappings
        xmlns="http://xmlns.jcp.org/xml/ns/validation/mapping"
        xmlns:xsi="http://www.w3.org/2001/XMLSchema-instance"
        xsi:schemaLocation="http://xmlns.jcp.org/xml/ns/validation/mapping
            http://xmlns.jcp.org/xml/ns/validation/mapping/validation-mapping-2.0.xsd"
        version="2.0">
        
    <default-package>org.hibernate.validator.internal.xml</default-package>

    <bean class="org.hibernate.validator.test.internal.xml.Child" ignore-annotations="false">
        <getter name="parentAttribute">
            <constraint annotation="javax.validation.constraints.NotNull"/>
        </getter>
        <getter name="parentListAttribute">
            <container-element-type type-argument-index="0">
                <constraint annotation="javax.validation.constraints.NotNull"/>
            </container-element-type>
        </getter>
    </bean>

</constraint-mappings>
